{
  "schema": "ccuv.official-dataset-catalog-envelope/v1",
  "key_id": "ccuv-official-2026-01",
  "signed": {
    "catalog_version": 1,
    "entries": [
      {
        "artifacts": [
          {
            "asset_name": "ccuv-dataset-weread-darwin-arm64.tar.gz",
            "download_url": "https://github.com/Cookie-HOO/ccuv-dataset-weread/releases/download/v0.1.1/ccuv-dataset-weread-darwin-arm64.tar.gz",
            "manifest_sha256": "7e959e8bc0a8f6b0c1fbe1a8fc82939823fd045214d62a3816316b69769f2303",
            "platform": {
              "arch": "arm64",
              "os": "darwin"
            },
            "release_tag": "v0.1.1",
            "sha256": "97adf5a8816f490a7782b0deec801bc9fa5f3d9f16646cf40ae90bfca9c15d00",
            "size": 2932234
          },
          {
            "asset_name": "ccuv-dataset-weread-darwin-amd64.tar.gz",
            "download_url": "https://github.com/Cookie-HOO/ccuv-dataset-weread/releases/download/v0.1.1/ccuv-dataset-weread-darwin-amd64.tar.gz",
            "manifest_sha256": "9fcdec6db36ca0fda488d03febd82d4ad946597687659e06de447976c1ed98e7",
            "platform": {
              "arch": "amd64",
              "os": "darwin"
            },
            "release_tag": "v0.1.1",
            "sha256": "65ffbe4d305efd94cb6ff65eb0ff9a3f5809e488fe5e42402df286f173202eba",
            "size": 3168013
          },
          {
            "asset_name": "ccuv-dataset-weread-linux-amd64.tar.gz",
            "download_url": "https://github.com/Cookie-HOO/ccuv-dataset-weread/releases/download/v0.1.1/ccuv-dataset-weread-linux-amd64.tar.gz",
            "manifest_sha256": "90daddba814e222a019ea20dbe6d91aeada095c73e5e3bc1935b711499c88cf3",
            "platform": {
              "arch": "amd64",
              "os": "linux"
            },
            "release_tag": "v0.1.1",
            "sha256": "829799675f88c0a6b1d1bd4714082385e255379521c0293b1fec726d9b6e50ff",
            "size": 3115409
          },
          {
            "asset_name": "ccuv-dataset-weread-windows-amd64.tar.gz",
            "download_url": "https://github.com/Cookie-HOO/ccuv-dataset-weread/releases/download/v0.1.1/ccuv-dataset-weread-windows-amd64.tar.gz",
            "manifest_sha256": "e366f53176034a8928c7b3d6c5d932fa412be470810ad863f448b7e81edd6647",
            "platform": {
              "arch": "amd64",
              "os": "windows"
            },
            "release_tag": "v0.1.1",
            "sha256": "d98e0f55f59d9e265d012f3d2459e698436136453e9c3b7bbe1187295f0cbb29",
            "size": 3208130
          }
        ],
        "id": "weread",
        "repository": "Cookie-HOO/ccuv-dataset-weread",
        "summary": {
          "en": "Visualize your WeRead reading time and book activity.",
          "zh-CN": "将微信读书的阅读时长和书籍活动可视化。"
        },
        "title": {
          "en": "WeRead",
          "zh-CN": "微信读书"
        }
      },
      {
        "artifacts": [
          {
            "asset_name": "ccuv-dataset-openstarmap-darwin-amd64.tar.gz",
            "download_url": "https://github.com/Cookie-HOO/ccuv-dataset-openstarmap/releases/download/v0.1.0/ccuv-dataset-openstarmap-darwin-amd64.tar.gz",
            "manifest_sha256": "ed234a333009cac1fa307f8bab6372bf49efb0b5842c2d8f61883a7fdf208be8",
            "platform": {
              "arch": "amd64",
              "os": "darwin"
            },
            "release_tag": "v0.1.0",
            "sha256": "0359c13df3e7cdc143acf1bf5148eb22b47fef9ae6c861446815bd02cfffdefe",
            "size": 3170011
          },
          {
            "asset_name": "ccuv-dataset-openstarmap-darwin-arm64.tar.gz",
            "download_url": "https://github.com/Cookie-HOO/ccuv-dataset-openstarmap/releases/download/v0.1.0/ccuv-dataset-openstarmap-darwin-arm64.tar.gz",
            "manifest_sha256": "fe23972187b813071afe74c6721cad14e33a06574333c6f2a8bc44428a69acbc",
            "platform": {
              "arch": "arm64",
              "os": "darwin"
            },
            "release_tag": "v0.1.0",
            "sha256": "7f37180cbf05854f3db888e38b60770f7d76ccdd731befb58579fe7b85c5744b",
            "size": 2931808
          },
          {
            "asset_name": "ccuv-dataset-openstarmap-linux-amd64.tar.gz",
            "download_url": "https://github.com/Cookie-HOO/ccuv-dataset-openstarmap/releases/download/v0.1.0/ccuv-dataset-openstarmap-linux-amd64.tar.gz",
            "manifest_sha256": "432fa23adc648cb2dd3492323726ecbbf54d7bc3c0bb3ab96b1994b9606f7e84",
            "platform": {
              "arch": "amd64",
              "os": "linux"
            },
            "release_tag": "v0.1.0",
            "sha256": "e51e85f9530dc09d1e2fab41d14f1df5e0dc051641d2bf758e917e4971fb276d",
            "size": 3119381
          },
          {
            "asset_name": "ccuv-dataset-openstarmap-windows-amd64.tar.gz",
            "download_url": "https://github.com/Cookie-HOO/ccuv-dataset-openstarmap/releases/download/v0.1.0/ccuv-dataset-openstarmap-windows-amd64.tar.gz",
            "manifest_sha256": "b5dc502dd1f6f62d5c2f178e47ac2252bde6c2d3e705fbeeabf4c44b5e19661d",
            "platform": {
              "arch": "amd64",
              "os": "windows"
            },
            "release_tag": "v0.1.0",
            "sha256": "50a1a7bcfcf9a55c0b39eded2f163c1d09e5ec4f3e12542a0322f034954528a6",
            "size": 3209485
          }
        ],
        "id": "openstarmap",
        "repository": "Cookie-HOO/ccuv-dataset-openstarmap",
        "summary": {
          "en": "Discover current open-source projects through Stars, growth, and public recommendations.",
          "zh-CN": "通过 Star、增长趋势与公开推荐发现当前开源项目。"
        },
        "title": {
          "en": "OpenStarMap",
          "zh-CN": "开源星图"
        }
      }
    ],
    "issued_at": "2026-10-19T10:25:00Z",
    "schema": "ccuv.official-dataset-catalog/v1"
  },
  "signature": {
    "algorithm": "Ed25519",
    "encoding": "base64",
    "value": "5L05AEyNnkJYHdhvwjezSXWmkUp18eL/D7E9PM5BaIP4KoPoJcnFY6omioweDPtb5Bhu2EGo/KJhQMpXM9LpAQ=="
  }
}
